{
  "schema_version": 1,
  "name": "",
  "email": "",
  "phone_label": "",
  "phone_href": "",
  "location": "",
  "languages": "",
  "linkedin": "",
  "website": "",
  "localized": {
    "de-CH": {
      "nationality_and_permit": "",
      "availability": ""
    },
    "en-CH": {
      "nationality_and_permit": "",
      "availability": ""
    }
  }
}
